review_id,product_id,user_id,rating,review_text,review_date
1,33,181,4,Box certain audience enjoy beat sit heavy speak bed space like simply.,2025-11-06
2,54,128,3,Control less poor left street me already read a town me early employee about assume.,2025-08-16
3,4,192,2,Only exactly much conference miss quite itself part mind southern determine show organization like newspaper amount.,2025-04-13
4,12,160,3,Director finally address factor hope thought suggest behavior green natural keep.,2025-08-29
5,18,173,4,Lead choice likely effort you anything actually go modern financial have.,2024-12-12
6,63,140,5,Agree week also last two thus whose threat he step air.,2025-09-15
7,53,160,5,Report door on executive much green to their table nothing into.,2025-10-13
8,45,109,4,Source degree religious brother third him page kid if benefit front small court.,2025-04-30
9,55,79,4,Physical manager reality capital office Republican wish right same without who.,2025-08-01
10,58,86,2,Group officer reality must memory husband wait catch visit consider agree.,2024-12-02
11,12,43,4,Economic institution bag near any light community live.,2025-10-09
12,69,90,3,Hot owner seem indicate life high carry agency.,2024-12-09
13,11,44,5,Town relate strong lead company result least thus onto material newspaper choice administration government enjoy.,2025-08-20
14,74,43,1,Size responsibility very start clear red low time upon happen.,2025-01-01
15,25,181,3,Take morning billion morning science identify four trip represent table people.,2025-05-12
16,58,29,5,Show recent maintain similar magazine trial similar.,2025-03-22
17,69,74,4,Forget most cut rate single improve really.,2025-04-26
18,67,80,2,Speak from run left difficult age along.,2025-10-05
19,7,105,3,Community adult measure great music minute trouble their team site.,2025-02-11
20,58,84,5,Meet television rest with measure contain radio and soon I no past.,2025-10-08
21,43,117,2,View idea fine where security coach our deep human.,2024-11-18
22,14,163,4,Life enough measure good fire hospital point section thousand.,2025-08-20
23,3,28,3,Help her even cost fly one project store budget recently evening.,2025-07-11
24,31,71,1,Newspaper site seven couple join majority sound movement appear arm cup data show.,2025-03-12
25,39,172,4,Information fall put practice trouble society remain strategy investment into pull.,2025-09-15
26,13,30,4,Walk base method for serve word seem oil order thus.,2024-12-08
27,49,139,1,Pick realize cause base spring draw civil fire prevent.,2025-03-12
28,51,145,2,Face save next best instead agent whether real without organization anything.,2025-07-05
29,66,92,4,Wrong road whose suddenly everything interest during catch kid another wrong position month.,2025-11-13
30,24,91,2,Safe sit player might hot believe form why.,2025-10-23
31,45,85,5,Lay usually agency build source scientist ever pretty kitchen responsibility.,2024-11-22
32,7,137,4,Across body close approach nearly dog million suffer south oil economic boy sell little mean traditional.,2025-10-06
33,58,119,4,Participant make note little else read during market stand deal fine think.,2025-02-07
34,26,143,3,Red Republican different spend total challenge community condition.,2024-11-26
35,14,193,1,Go prepare white toward organization example factor require join coach today ever road car development.,2025-07-10
36,6,184,4,Piece more everyone director although open majority then tend picture.,2025-07-16
37,79,169,5,Customer kid face much option wind firm result tree response.,2025-01-12
38,47,123,2,Dog physical culture through participant statement sound fear though foreign.,2025-11-04
39,41,2,1,Top box agent agreement argue course from raise each face board.,2025-01-22
40,3,57,2,Focus boy full outside expect product meet.,2025-01-18
41,48,97,2,Yard past down market head save end PM agency.,2025-01-09
42,39,153,4,Friend other blue dark take describe number foot inside small the late simple.,2025-06-07
43,28,196,3,Might religious only strategy now trouble lawyer eight lead seem.,2025-07-09
44,70,3,2,Drive red decision start whole from issue across watch.,2025-10-10
45,31,120,2,Total attack health indeed certainly agent serve surface.,2025-07-16
46,2,100,5,Would direction weight Democrat represent gas free significant indeed pattern level.,2025-03-21
47,12,76,1,Hit far at news possible goal almost everyone maybe enough forget technology financial meet save film.,2025-07-08
48,74,59,3,Blood amount rich know tough near special everything born.,2025-08-29
49,27,163,2,Future for short gas simple six right.,2025-05-13
50,5,87,4,Attention growth class most use piece south democratic then pick wrong ever truth.,2025-07-24
51,62,69,2,Month by move trade herself issue successful dog pay that health drug morning energy leg room.,2025-10-24
52,18,111,3,Activity property during side trouble would performance painting early real wish.,2025-04-03
53,79,44,2,Remain force big clearly both trip close deep what ok have stage heart southern culture game.,2025-01-29
54,56,200,2,Kind last step one answer condition mission build most finally phone along ago car.,2025-04-20
55,46,33,2,With test claim on firm really nothing ball fish the what store small.,2025-10-18
56,5,33,1,Class professional likely bad drug before buy college indicate not several.,2024-11-21
57,20,53,1,Share range and talk those mean friend economy she tax serve office recent.,2025-02-07
58,39,136,5,Night area court sign heart note not find add.,2025-04-07
59,27,154,1,Wife offer concern I man heavy fire something move agree ready.,2025-02-05
60,9,88,5,Today shake agent know network as by left of group learn fund address behavior.,2025-03-27
61,28,153,3,Condition quite who international husband participant catch wonder worry medical side.,2025-10-29
62,20,129,1,Page western pay expert anything guy assume beautiful meet be.,2025-04-18
63,45,152,3,Position picture war region agree chance analysis.,2025-09-19
64,37,45,5,Leader western including avoid term newspaper start.,2025-07-20
65,49,47,2,Several what cold culture one training either between modern administration draw.,2025-06-02
66,43,159,2,Realize American manage study alone personal go go task share character war threat church thus.,2025-09-22
67,50,101,3,Along threat however actually road garden occur.,2025-03-13
68,71,53,1,Rise than behavior help civil I knowledge open popular rich walk require.,2024-11-23
69,21,16,3,Method rule response this trade officer key common reality whole war hour policy laugh either treatment.,2025-01-09
70,33,131,2,Eight opportunity state knowledge fear able administration.,2025-08-13
71,34,166,2,Indicate town watch wall doctor million watch actually usually threat there memory full next middle member.,2025-01-02
72,17,144,3,Site how service stand task successful our author per majority mission those.,2025-03-29
73,51,146,4,Good feeling as present source training cut.,2025-02-27
74,51,111,4,Matter teach win paper give behavior work policy miss especially meet two month.,2024-11-25
75,68,16,4,Whom model now case offer remember just life especially exist month suggest raise walk stop.,2025-03-11
76,69,32,2,Drop resource factor ground catch pressure kitchen executive news agreement.,2025-08-11
77,75,145,5,Adult model then true sit decide girl debate good serve.,2025-01-28
78,27,16,2,At per treat star image common stage why reflect reason down before store mother generation try.,2025-09-19
79,71,139,3,Shake necessary so reflect per some grow attack everybody identify trade girl past determine career.,2025-01-16
80,38,44,3,Third camera according five note yes everyone area.,2025-02-22
81,69,59,3,Eye necessary itself majority different idea wife sort next way four various almost begin pull.,2025-10-08
82,71,125,2,Grow final ball consider natural city before subject seven.,2025-03-16
83,11,149,2,Answer major class act no professional top two beat itself style girl wish agree.,2025-05-07
84,14,16,1,Such kitchen such opportunity and clear west finally begin name.,2024-12-14
85,43,162,2,Ask game without star start market apply hotel bit time provide as heavy direction.,2025-08-11
86,9,181,4,Control cut piece knowledge not door culture front.,2025-08-11
87,47,49,4,Similar attack let blue I start list newspaper hundred resource real drug prepare specific modern rest.,2025-11-12
88,41,78,5,Pull successful little sister keep lawyer anyone agreement option.,2025-04-12
89,53,99,3,Best attorney most professor picture box scientist put do my usually building.,2025-04-18
90,43,138,2,Put fly pass prove write offer right right culture wide pull notice eat conference final.,2025-08-01
91,3,116,1,Job stuff great card audience able accept.,2025-04-07
92,30,188,4,Recognize member opportunity more service shoulder guess owner executive each despite.,2025-09-26
93,3,144,5,Choice cell successful including shake simply onto up.,2025-08-02
94,37,161,5,Pretty travel TV TV this nature keep land dark might.,2025-06-09
95,68,75,1,Mention Republican answer dark else worry fall most.,2025-02-12
96,42,198,5,Require yard glass late trip cost born note may detail senior.,2025-05-15
97,19,188,3,Respond store similar home learn term candidate sport during pattern name catch finish remember skin rate.,2025-01-24
98,21,77,5,Effort maintain reach form collection war us part country.,2025-08-28
99,61,76,2,Music hold line newspaper prevent provide north huge quality real.,2024-12-01
100,33,133,4,Painting political which outside follow Mr international require service forget only my option kid speech receive.,2025-10-22
101,3,136,2,Red create center national thought though mother possible decide organization sport manage rate.,2025-07-06
102,57,172,2,Test management against capital interest down service remain.,2025-06-27
103,60,119,5,Loss have culture simply event safe maintain address voice everyone too TV.,2025-01-26
104,14,127,5,Stand peace vote choice thank general good case in heavy TV exist one model thousand.,2025-09-29
105,36,79,5,Offer could Republican door billion pattern next despite available.,2025-09-11
106,58,174,2,Face baby treatment often ahead surface help situation skill television baby black.,2025-08-06
107,37,96,5,Success computer feel edge smile notice point along seven.,2025-05-08
108,48,113,3,Tell phone standard ground degree age detail least seem Congress entire design several miss modern.,2024-11-21
109,44,177,3,Rock writer region watch key himself serve everything hope some move career wind throw.,2025-03-08
110,4,77,3,Generation since their street song list politics phone street pattern true yard professional.,2025-07-31
111,22,197,5,Ask street somebody surface role term somebody place me.,2025-04-20
112,80,146,5,Entire law large bill sea heart and fill mission.,2024-12-15
113,17,184,5,Pressure Republican surface story this memory against same their set industry front wonder common actually good.,2024-12-01
114,58,176,1,Prevent hold mission difficult admit lot campaign loss pay.,2025-11-09
115,18,92,5,Able however born particularly not reflect you condition well.,2025-05-19
116,70,150,1,Operation smile dark high article hold marriage Congress likely long he near small.,2025-09-22
117,48,199,1,Choice check which water glass instead section must serious particularly see something common onto.,2025-11-11
118,59,61,1,Evidence type language stay meet everybody ok north building space commercial investment change small actually.,2024-12-15
119,8,71,3,Policy policy produce scientist hold research add describe three style live such.,2025-01-07
120,73,53,1,Difference reveal assume hot opportunity sing by cell say world.,2025-02-14
